{
  "$schema": "https://json-schema.org/draft/2020-12/schema",
  "$id": "https://docs.atomus.io/schemas/component.schema.json",
  "title": "Atomus component",
  "description": "One component of the Atomus design system: a React export of @stanvision/atomus-react, or a Figma-only component set that has no React export. Generated by scripts/build-manifest.mjs.",
  "type": "object",
  "additionalProperties": false,
  "required": ["name", "kind", "status", "since", "import", "purpose", "aliases", "props", "rules", "examples", "figma", "related", "a11y"],
  "properties": {
    "name": {
      "description": "React export name (Button) or, for Figma-only components, the Figma component set name (Drawer).",
      "type": "string",
      "minLength": 1
    },
    "kind": {
      "description": "component = renders UI; hook = a React hook (useToast).",
      "enum": ["component", "hook"]
    },
    "status": {
      "description": "stable = exported by @stanvision/atomus-react; figma-only = exists in the Figma file only (never import it in code); beta and deprecated are reserved.",
      "enum": ["stable", "beta", "deprecated", "figma-only"]
    },
    "since": {
      "description": "Atomus version that introduced the component.",
      "type": "string",
      "pattern": "^\\d+\\.\\d+\\.\\d+$"
    },
    "category": {
      "description": "Catalogue group (Actions, Forms and inputs, Feedback …).",
      "type": ["string", "null"]
    },
    "import": {
      "description": "The import statement, or null for Figma-only components.",
      "type": ["string", "null"]
    },
    "source": {
      "description": "Repo path of the TypeScript source (React) or of the guideline file (Figma-only).",
      "type": "string"
    },
    "purpose": {
      "description": "What to use the component for, in one sentence.",
      "type": "string"
    },
    "description": {
      "description": "The Figma component description from the guidelines.",
      "type": ["string", "null"]
    },
    "aliases": {
      "description": "Other names people use for it (dialog → Modal). From guidelines/overview-components.md.",
      "type": "array",
      "items": { "type": "string" },
      "uniqueItems": true
    },
    "alternative": {
      "description": "Figma-only components: what to use in code instead.",
      "type": ["string", "null"]
    },
    "native": {
      "description": "React components that spread native attributes: the element whose attributes they accept (button, input, a, element = any HTML element).",
      "type": "object",
      "additionalProperties": false,
      "required": ["elements", "omit", "ref"],
      "properties": {
        "elements": { "type": "array", "items": { "type": "string" } },
        "omit": { "type": "array", "items": { "type": "string" } },
        "ref": { "type": "boolean", "description": "true when ref is forwarded to the root element." }
      }
    },
    "props": {
      "description": "Props by name. For Figma-only components these are the Figma properties.",
      "type": "object",
      "additionalProperties": { "$ref": "#/$defs/prop" }
    },
    "rules": {
      "type": "object",
      "additionalProperties": false,
      "required": ["do", "dont", "forbidden"],
      "properties": {
        "do": { "type": "array", "items": { "type": "string" } },
        "dont": { "type": "array", "items": { "type": "string" } },
        "forbidden": { "type": "array", "items": { "type": "string" } }
      }
    },
    "examples": {
      "type": "array",
      "items": { "$ref": "#/$defs/example" }
    },
    "figma": { "$ref": "#/$defs/figma" },
    "docs": {
      "description": "Docs page on docs.atomus.io.",
      "type": ["string", "null"],
      "pattern": "^https://docs\\.atomus\\.io/"
    },
    "related": {
      "description": "Names of related entries in the manifest.",
      "type": "array",
      "items": { "type": "string" },
      "uniqueItems": true
    },
    "a11y": {
      "type": "object",
      "additionalProperties": false,
      "required": ["notes"],
      "properties": {
        "element": { "type": ["string", "null"], "description": "Native element or ARIA role the component renders." },
        "requiresLabel": { "type": "boolean", "description": "true when the component needs a visible label or an aria-label." },
        "notes": { "type": "array", "items": { "type": "string" } }
      }
    }
  },
  "$defs": {
    "prop": {
      "type": "object",
      "additionalProperties": false,
      "required": ["type", "required"],
      "properties": {
        "type": { "type": "string", "description": "TypeScript type (React) or Figma property type (text, boolean, variant, instance swap, slot)." },
        "values": {
          "type": "array",
          "description": "Allowed literal values when the prop is an enum.",
          "items": { "type": ["string", "number"] }
        },
        "default": { "type": ["string", "number", "boolean", "null"], "description": "Default value as written in source (e.g. 'secondary'), or null." },
        "required": { "type": "boolean" },
        "figma": { "type": ["string", "null"], "description": "Figma property this prop mirrors (Hierarchy, Size, State=Loading …)." },
        "notes": { "type": ["string", "null"] }
      }
    },
    "example": {
      "type": "object",
      "additionalProperties": false,
      "required": ["title", "code", "language"],
      "properties": {
        "title": { "type": "string" },
        "code": { "type": "string" },
        "language": { "enum": ["tsx", "jsx", "html", "css"] },
        "source": { "type": "string" }
      }
    },
    "figmaPropertyMapping": {
      "type": "object",
      "additionalProperties": false,
      "required": ["figma", "prop", "kind"],
      "properties": {
        "figma": { "type": "string", "description": "Figma property name." },
        "prop": { "type": "string", "description": "React prop it maps to (children = the element's content)." },
        "kind": { "enum": ["enum", "text", "boolean", "flag", "instance", "expression"], "description": "enum = value map; text = string copied; boolean = toggles a prop; flag = prop is true when the Figma enum has one value (State=Loading → loading); instance = nested instance; expression = custom logic (see notes)." },
        "values": { "type": "object", "additionalProperties": { "type": ["string", "number", "boolean"] }, "description": "Figma value → prop value." },
        "when": { "type": "string", "description": "kind=flag: the Figma value that turns the prop on." },
        "visibleWhen": { "type": "string", "description": "Boolean Figma property that must be on for the prop to render." },
        "whenTrue": { "type": "string", "description": "kind=boolean: JSX attribute rendered when the Figma boolean is on." },
        "whenFalse": { "type": "string", "description": "kind=boolean: JSX attribute rendered when the Figma boolean is off." },
        "notes": { "type": "string" }
      }
    },
    "figmaNode": {
      "type": "object",
      "additionalProperties": false,
      "required": ["componentSet", "nodeId"],
      "properties": {
        "componentSet": { "type": "string" },
        "nodeId": { "type": "string", "pattern": "^\\d+:\\d+$" },
        "codeConnectId": { "type": "string" },
        "staticProps": { "type": "string", "description": "Attributes the Code Connect template always renders (iconOnly …)." },
        "mappings": { "type": "array", "items": { "$ref": "#/$defs/figmaPropertyMapping" } }
      }
    },
    "figma": {
      "type": "object",
      "additionalProperties": false,
      "required": ["componentSet", "nodeIds", "codeConnect"],
      "properties": {
        "componentSet": { "type": "array", "items": { "type": "string" }, "description": "Figma component set names this entry covers." },
        "fileKey": { "type": ["string", "null"], "description": "Key of the original Atomus Figma file (sold separately). Projects use their own copy." },
        "nodeIds": { "type": "array", "items": { "type": "string", "pattern": "^\\d+:\\d+$" } },
        "nodes": { "type": "array", "items": { "$ref": "#/$defs/figmaNode" } },
        "codeConnect": { "type": "boolean", "description": "true when a Code Connect template maps the Figma component to this React component." },
        "variants": { "type": ["integer", "null"] },
        "properties": {
          "type": "array",
          "description": "Figma component properties from the guidelines.",
          "items": {
            "type": "object",
            "additionalProperties": false,
            "required": ["name", "type"],
            "properties": {
              "componentSet": { "type": "string" },
              "name": { "type": "string" },
              "type": { "type": "string" },
              "options": { "type": "array", "items": { "type": "string" } }
            }
          }
        },
        "docs": { "type": ["string", "null"], "pattern": "^https://docs\\.atomus\\.io/" }
      }
    }
  }
}
