{
  "name": "Status tag",
  "kind": "component",
  "status": "figma-only",
  "since": "4.0.0",
  "category": "Media and assets",
  "import": null,
  "source": "guidelines/components/shared-assets.md",
  "purpose": "Hand-off status on frames.",
  "description": "Hand-off status on frames.",
  "aliases": [],
  "alternative": "These are design-only mockups and annotations; they have no code counterpart.",
  "props": {
    "Status": {
      "type": "variant",
      "values": ["Ready for dev","In progress","Needs review","Deprecated"],
      "default": null,
      "required": false,
      "figma": "Status",
      "notes": null
    }
  },
  "rules": {"do":[],"dont":[],"forbidden":[]},
  "examples": [],
  "figma": {
    "componentSet": ["Status tag"],
    "fileKey": null,
    "nodeIds": [],
    "nodes": [],
    "codeConnect": false,
    "variants": 4,
    "docs": "https://docs.atomus.io/components/shared-assets/"
  },
  "docs": "https://docs.atomus.io/components/shared-assets/",
  "related": [
    "Credit card",
    "Video player",
    "Email template",
    "Annotation marker",
    "Annotation note",
    "Spec line",
    "A11y annotation"
  ],
  "a11y": {"element":null,"requiresLabel":false,"notes":[]}
}
