{
  "name": "Avatar group",
  "kind": "component",
  "status": "figma-only",
  "since": "4.0.0",
  "category": "Data display",
  "import": null,
  "source": "guidelines/components/avatar.md",
  "purpose": "A person or workspace.",
  "description": "Stacked avatars with overflow count.",
  "aliases": [],
  "alternative": "Avatar group and Avatar label group are Figma-only: render several `Avatar`s in a row (negative inline margin) or an `Avatar` next to the name and email text.",
  "props": {
    "Size": {"type":"variant","values":["xs","sm","md"],"default":null,"required":false,"figma":"Size","notes":null}
  },
  "rules": {"do":[],"dont":["Don't use stock faces as placeholders — use initials."],"forbidden":[]},
  "examples": [],
  "figma": {
    "componentSet": ["Avatar group"],
    "fileKey": null,
    "nodeIds": [],
    "nodes": [],
    "codeConnect": false,
    "variants": 3,
    "docs": "https://docs.atomus.io/components/avatar/"
  },
  "docs": "https://docs.atomus.io/components/avatar/",
  "related": ["Avatar","Avatar photo","Avatar label group"],
  "a11y": {"element":null,"requiresLabel":false,"notes":[]}
}
