{
  "name": "Annotation note",
  "kind": "component",
  "status": "figma-only",
  "since": "4.0.0",
  "category": "Media and assets",
  "import": null,
  "source": "guidelines/components/shared-assets.md",
  "purpose": "Hand-off callout.",
  "description": "Hand-off callout.",
  "aliases": [],
  "alternative": "These are design-only mockups and annotations; they have no code counterpart.",
  "props": {
    "Title": {"type":"text","default":null,"required":false,"figma":"Title","notes":null},
    "Body": {"type":"text","default":null,"required":false,"figma":"Body","notes":null},
    "Type": {
      "type": "variant",
      "values": ["Note","Spec","Question","Issue"],
      "default": null,
      "required": false,
      "figma": "Type",
      "notes": null
    }
  },
  "rules": {"do":[],"dont":[],"forbidden":[]},
  "examples": [],
  "figma": {
    "componentSet": ["Annotation note"],
    "fileKey": null,
    "nodeIds": [],
    "nodes": [],
    "codeConnect": false,
    "variants": 4,
    "docs": "https://docs.atomus.io/components/shared-assets/"
  },
  "docs": "https://docs.atomus.io/components/shared-assets/",
  "related": [
    "Credit card",
    "Video player",
    "Email template",
    "Annotation marker",
    "Spec line",
    "Status tag",
    "A11y annotation"
  ],
  "a11y": {"element":null,"requiresLabel":false,"notes":[]}
}
