{
  "name": "Radio",
  "kind": "component",
  "status": "stable",
  "since": "4.0.0",
  "category": "Forms and inputs",
  "import": "import { Radio } from '@stanvision/atomus-react';",
  "source": "react/src/components/Choice.tsx",
  "purpose": "One choice from 2–5 visible options.",
  "description": "Radio button for groups of mutually exclusive options.",
  "aliases": [],
  "alternative": null,
  "native": {"elements":["input"],"omit":["size","type"],"ref":true},
  "props": {
    "label": {"type":"string","default":null,"required":false,"figma":"Label","notes":"Figma: Label (+ Show label)"},
    "description": {
      "type": "string",
      "default": null,
      "required": false,
      "figma": "Description",
      "notes": "Figma: Description (+ Show description)"
    },
    "size": {
      "type": "'sm' | 'md'",
      "values": ["sm","md"],
      "default": "sm",
      "required": false,
      "figma": "Size",
      "notes": "Figma: Size — sm (16 control, 14px label) · md (20 control, 16px label)"
    }
  },
  "rules": {
    "do": ["Use for one choice from 2–5 visible options.","Preselect a sensible default when there is one."],
    "dont": [],
    "forbidden": [
      "Never use a single radio on its own — use Checkbox.",
      "Never use radios for more than about five options — use Select."
    ]
  },
  "examples": [
    {
      "title": "Usage",
      "code": "import { Checkbox, Radio, Toggle } from '@stanvision/atomus-react';\n\n<Checkbox label=\"Email me updates\" defaultChecked />\n<Radio name=\"plan\" label=\"Pro\" description=\"Unlimited projects\" />\n<Toggle label=\"Dark mode\" size=\"md\" />",
      "language": "tsx",
      "source": "sites/docs/src/component-pages/checkbox-radio-toggle.mdx"
    }
  ],
  "figma": {
    "componentSet": ["Radio"],
    "fileKey": "bC42e82J3PYg2LMkryodIA",
    "nodeIds": ["25419:14694"],
    "nodes": [
      {
        "componentSet": "Radio",
        "nodeId": "25419:14694",
        "codeConnectId": "Radio",
        "staticProps": "name=\"group\"",
        "mappings": [
          {"figma":"Label","prop":"label","kind":"text","visibleWhen":"Show label"},
          {"figma":"Description","prop":"description","kind":"text","visibleWhen":"Show description"},
          {"figma":"Size","prop":"size","kind":"enum","values":{"sm":"sm","md":"md"}},
          {"figma":"Checked","prop":"defaultChecked","kind":"flag","when":"True"},
          {
            "figma": "State",
            "prop": "disabled",
            "kind": "expression",
            "notes": "instance.getEnum('State', { Disabled: true }) === true"
          }
        ]
      }
    ],
    "codeConnect": true,
    "variants": 16,
    "properties": [
      {"componentSet":"Radio","name":"Label","type":"text"},
      {"componentSet":"Radio","name":"Show label","type":"boolean (on)"},
      {"componentSet":"Radio","name":"Description","type":"text"},
      {"componentSet":"Radio","name":"Show description","type":"boolean (off)"},
      {"componentSet":"Radio","name":"Size","type":"variant","options":["sm","md"]},
      {"componentSet":"Radio","name":"Checked","type":"variant","options":["False","True"]},
      {
        "componentSet": "Radio",
        "name": "State",
        "type": "variant",
        "options": ["Default","Hover","Focused","Disabled"]
      }
    ],
    "docs": "https://docs.atomus.io/components/checkbox-radio-toggle/"
  },
  "docs": "https://docs.atomus.io/components/checkbox-radio-toggle/",
  "related": ["Checkbox","Toggle"],
  "a11y": {
    "element": "input",
    "requiresLabel": true,
    "notes": [
      "`label`: Figma: Label (+ Show label)",
      "`size`: Figma: Size — sm (16 control, 14px label) · md (20 control, 16px label)"
    ]
  }
}
