{
  "name": "Message input",
  "kind": "component",
  "status": "figma-only",
  "since": "4.0.0",
  "category": "Data display",
  "import": null,
  "source": "guidelines/components/messaging.md",
  "purpose": "Messaging.",
  "description": "Composer for chat and comments.",
  "aliases": [],
  "alternative": "Compose Chat from `Avatar`, tokens and a native `<textarea>`.",
  "props": {"Placeholder":{"type":"text","default":null,"required":false,"figma":"Placeholder","notes":null}},
  "rules": {"do":[],"dont":[],"forbidden":[]},
  "examples": [],
  "figma": {
    "componentSet": ["Message input"],
    "fileKey": null,
    "nodeIds": [],
    "nodes": [],
    "codeConnect": false,
    "variants": 1,
    "docs": "https://docs.atomus.io/components/messaging/"
  },
  "docs": "https://docs.atomus.io/components/messaging/",
  "related": ["Message bubble","Chat"],
  "a11y": {"element":null,"requiresLabel":false,"notes":[]}
}
