{
  "name": "Color picker",
  "kind": "component",
  "status": "figma-only",
  "since": "4.0.0",
  "category": "Forms and inputs",
  "import": null,
  "source": "guidelines/components/tree-editor-color-picker.md",
  "purpose": "Picking a colour.",
  "description": "Saturation area, hue slider, eyedropper, hex field and presets.",
  "aliases": [],
  "alternative": "Tree view, Text editor and Color picker are Figma-only.",
  "props": {},
  "rules": {"do":[],"dont":[],"forbidden":[]},
  "examples": [],
  "figma": {
    "componentSet": ["Color picker"],
    "fileKey": null,
    "nodeIds": [],
    "nodes": [],
    "codeConnect": false,
    "variants": 1,
    "docs": "https://docs.atomus.io/components/color-picker/"
  },
  "docs": "https://docs.atomus.io/components/color-picker/",
  "related": ["Tree item","Tree view","Editor toolbar button","Text editor","Color swatch"],
  "a11y": {"element":null,"requiresLabel":false,"notes":[]}
}
