{
  "name": "Notifications panel",
  "kind": "component",
  "status": "figma-only",
  "since": "4.0.0",
  "category": "Feedback",
  "import": null,
  "source": "guidelines/components/message-alert.md",
  "purpose": "The bell-icon inbox.",
  "description": "Dropdown panel for the bell icon: header, tabs, rows, footer link.",
  "aliases": [],
  "alternative": "Notifications panel and Notification item are Figma-only.",
  "props": {},
  "rules": {
    "do": ["Mark unread rows with the Unread type and link to the full inbox in the footer."],
    "dont": [],
    "forbidden": ["Never use the panel for messages about the current page — use Alert."]
  },
  "examples": [],
  "figma": {
    "componentSet": ["Notifications panel"],
    "fileKey": null,
    "nodeIds": [],
    "nodes": [],
    "codeConnect": false,
    "variants": 1,
    "docs": "https://docs.atomus.io/components/notifications/"
  },
  "docs": "https://docs.atomus.io/components/notifications/",
  "related": ["Alert","Toast","Notification item"],
  "a11y": {"element":null,"requiresLabel":false,"notes":[]}
}
