{
  "name": "Carousel dots",
  "kind": "component",
  "status": "figma-only",
  "since": "4.0.0",
  "category": "Navigation",
  "import": null,
  "source": "guidelines/components/pagination.md",
  "purpose": "Slide indicator.",
  "description": "Slide indicator.",
  "aliases": [],
  "alternative": "Compose Pagination from `Button hierarchy=\"tertiary\" size=\"sm\"` items.",
  "props": {
    "Style": {
      "type": "variant",
      "values": ["Default","Brand"],
      "default": null,
      "required": false,
      "figma": "Style",
      "notes": null
    }
  },
  "rules": {"do":[],"dont":[],"forbidden":[]},
  "examples": [],
  "figma": {
    "componentSet": ["Carousel dots"],
    "fileKey": null,
    "nodeIds": [],
    "nodes": [],
    "codeConnect": false,
    "variants": 2,
    "docs": "https://docs.atomus.io/components/pagination/"
  },
  "docs": "https://docs.atomus.io/components/pagination/",
  "related": ["Pagination number","Pagination","Carousel"],
  "a11y": {"element":null,"requiresLabel":false,"notes":[]}
}
