{
  "name": "Inline CTA",
  "kind": "component",
  "status": "figma-only",
  "since": "4.0.0",
  "category": "Layout and content",
  "import": null,
  "source": "guidelines/components/card.md",
  "purpose": "A call to action inside app pages or articles.",
  "description": "Call-to-action block inside app pages or articles.",
  "aliases": [],
  "alternative": "Card header and Section footer are built into `Card` (`title`, `supportingText`, `headerAction`, `footer`). Inline CTA is Figma-only.",
  "props": {
    "Title": {"type":"text","default":null,"required":false,"figma":"Title","notes":null},
    "Text": {"type":"text","default":null,"required":false,"figma":"Text","notes":null},
    "Style": {
      "type": "variant",
      "values": ["Subtle","Brand","Outline"],
      "default": null,
      "required": false,
      "figma": "Style",
      "notes": null
    }
  },
  "rules": {
    "do": [],
    "dont": [
      "Don't nest cards; use dividers or a filled card instead.",
      "Don't add a coloured left border to signal status — use Alert or Badge."
    ],
    "forbidden": []
  },
  "examples": [],
  "figma": {
    "componentSet": ["Inline CTA"],
    "fileKey": null,
    "nodeIds": [],
    "nodes": [],
    "codeConnect": false,
    "variants": 3,
    "docs": "https://docs.atomus.io/components/card/"
  },
  "docs": "https://docs.atomus.io/components/card/",
  "related": ["Card"],
  "a11y": {"element":null,"requiresLabel":false,"notes":[]}
}
