{
  "name": "Bar chart",
  "kind": "component",
  "status": "figma-only",
  "since": "4.0.0",
  "category": "Data display",
  "import": null,
  "source": "guidelines/components/charts.md",
  "purpose": "Grouped bar chart (12 months, 2 series).",
  "description": "Grouped bar chart (12 months, 2 series).",
  "aliases": [],
  "alternative": "Use a charting library (Recharts, Chart.js, ECharts) and colour the key series with `--color-fg-brand` and comparisons with `--color-fg-tertiary`; grid lines use `--color-border-secondary`. `MetricCard type=\"chart\"` covers sparklines.",
  "props": {},
  "rules": {
    "do": [
      "Start the value axis at zero.",
      "Use the brand series for the key metric and grey for comparison.",
      "Add a legend when there is more than one series."
    ],
    "dont": [],
    "forbidden": ["Never use more than four series.","Never use 3D or gradients.","Never hide axis labels."]
  },
  "examples": [],
  "figma": {
    "componentSet": ["Bar chart"],
    "fileKey": null,
    "nodeIds": [],
    "nodes": [],
    "codeConnect": false,
    "variants": 1,
    "docs": "https://docs.atomus.io/components/charts/"
  },
  "docs": "https://docs.atomus.io/components/charts/",
  "related": ["Chart legend item","Line chart","Pie chart","Activity gauge","Radar chart"],
  "a11y": {"element":null,"requiresLabel":false,"notes":["Never hide axis labels."]}
}
