{
  "name": "Tree view",
  "kind": "component",
  "status": "figma-only",
  "since": "4.0.0",
  "category": "Data display",
  "import": null,
  "source": "guidelines/components/tree-editor-color-picker.md",
  "purpose": "Nested, expandable hierarchies (files, categories).",
  "description": "Example tree built from Tree items.",
  "aliases": [],
  "alternative": "Tree view, Text editor and Color picker are Figma-only.",
  "props": {},
  "rules": {
    "do": ["Use for files and categories.","Show expand and collapse chevrons.","Highlight the selected item."],
    "dont": [],
    "forbidden": [
      "Never nest deeper than four levels.",
      "Never use a tree for flat lists.",
      "Never load a huge tree at once — load children on expand."
    ]
  },
  "examples": [],
  "figma": {
    "componentSet": ["Tree view"],
    "fileKey": null,
    "nodeIds": [],
    "nodes": [],
    "codeConnect": false,
    "variants": 1,
    "docs": "https://docs.atomus.io/components/tree-view/"
  },
  "docs": "https://docs.atomus.io/components/tree-view/",
  "related": ["Tree item","Editor toolbar button","Text editor","Color swatch","Color picker"],
  "a11y": {"element":null,"requiresLabel":false,"notes":[]}
}
